{
  "format": "org.fitfreed.upgrade-matrix",
  "schemaVersion": 2,
  "release": {
    "version": "0.1.21",
    "librarySchemaVersion": 37
  },
  "supportedApplicationBaselines": [
    {
      "version": "0.1.12",
      "targets": ["darwin-aarch64", "linux-x86_64-deb"],
      "librarySchemaVersions": [37]
    }
  ],
  "supportedLibrarySchemaVersions": [1, 2, 3, 4, 5, 6, 7, 8, 9, 10, 11, 12, 13, 14, 15, 16, 17, 18, 19, 20, 21, 22, 23, 24, 25, 26, 27, 28, 29, 30, 31, 32, 33, 34, 35, 36, 37]
}
